Title,Value,Note,Suffix
Unemployment rate (all working age),4.1,"People aged 16-64, unemployed as at Jun-Aug 2024 (seasonally adjusted)",%
Economic inactivity rate (all working age),21.8,"People aged 16-64, economically inactive as at Jun-Aug 2024 (seasonally adjusted)",%
Unemployment rate (young people),13.6,"Young people aged 16-24, unemployed as at Jun-Aug 2024 (seasonally adjusted)",%
Economic inactivity rate (young people),41.2,"Young people aged 16-24, economically inactive as at Jun-Aug 2024 (seasonally adjusted)",%
Unemployment rate (Not in full-time education),12.6,"Young people aged 16-24, not in full-time education, unemployed as at Jun-Aug 2024 (seasonally adjusted)",%
Economic inactivity rate (Not in full-time education),19.8,"Young people aged 16-24, not in full-time education, economically inactive as at Jun-Aug 2024 (seasonally adjusted)",%
Long-term unemployment rate 6 to 12 months,13.5,"Young people aged 16-24, unemployed between 6 and 12 months as at Jun-Aug 2024 (seasonally adjusted)",%
Long-term unemployment rate over 12 months,95.0,"Young people aged 16-24, unemployed over 12 months as at Jun-Aug 2024 (seasonally adjusted)",%
