Title,Value,Note,Suffix
Unemployment rate (all working age),4.3,"People aged 16-64, unemployed as at Apr-Jun 2023 (seasonally adjusted)",%
Economic inactivity rate (all working age),20.9,"People aged 16-64, economically inactive as at Apr-Jun 2023 (seasonally adjusted)",%
Unemployment rate (young people),12.3,"Young people aged 16-24, unemployed as at Apr-Jun 2023 (seasonally adjusted)",%
Economic inactivity rate (young people),38.0,"Young people aged 16-24, economically inactive as at Apr-Jun 2023 (seasonally adjusted)",%
Unemployment rate (Not in full-time education),11.6,"Young people aged 16-24, not in full-time education, unemployed as at Apr-Jun 2023 (seasonally adjusted)",%
Economic inactivity rate (Not in full-time education),17.3,"Young people aged 16-24, not in full-time education, economically inactive as at Apr-Jun 2023 (seasonally adjusted)",%
Long-term unemployment rate 6 to 12 months,19.3,"Young people aged 16-24, unemployed between 6 and 12 months as at Apr-Jun 2023 (seasonally adjusted)",%
Long-term unemployment rate over 12 months,65.0,"Young people aged 16-24, unemployed over 12 months as at Apr-Jun 2023 (seasonally adjusted)",%
