Title,Value,Note,Suffix
Unemployment rate (all working age),4.5,"People aged 16-64, unemployed as at Sep-Nov 2024 (seasonally adjusted)",%
Economic inactivity rate (all working age),21.6,"People aged 16-64, economically inactive as at Sep-Nov 2024 (seasonally adjusted)",%
Unemployment rate (young people),14.5,"Young people aged 16-24, unemployed as at Sep-Nov 2024 (seasonally adjusted)",%
Economic inactivity rate (young people),41.1,"Young people aged 16-24, economically inactive as at Sep-Nov 2024 (seasonally adjusted)",%
Unemployment rate (Not in full-time education),12.7,"Young people aged 16-24, not in full-time education, unemployed as at Sep-Nov 2024 (seasonally adjusted)",%
Economic inactivity rate (Not in full-time education),20.9,"Young people aged 16-24, not in full-time education, economically inactive as at Sep-Nov 2024 (seasonally adjusted)",%
Long-term unemployment rate 6 to 12 months,17.5,"Young people aged 16-24, unemployed between 6 and 12 months as at Sep-Nov 2024 (seasonally adjusted)",%
Long-term unemployment rate over 12 months,105.0,"Young people aged 16-24, unemployed over 12 months as at Sep-Nov 2024 (seasonally adjusted)",%
